,Text
292,I'm struggling with my masculinity over having to give myself a shot once a week. Do have any advice on how to either beat my fear or come to terms and be okay with this?
293,What hobbies do you men have?
294,"Men who began learning an activity as an adult that most people begin as kids (i.e. sports, theater, dance, etc.) and turned it into a serious hobby/career, how did you do it?"
295,"Men of Reddit, has the size (too big or not big enough) of your dick ever been the reason for an ended relationship? What happened and how did you feel?"
296,What are your favorite lines or responses you always fall back on to make others smile?
297,When was a time things were going really badly and something happened to make everything suddenly a whole lot better?
298,How can men prepare for a honeymoon?
299,How do you handle your girlfriend talking to past one night stands?
300,"Men who almost lost a good woman who had been trying to tell you she was unhappy, what’s the story of how your eyes and ears finally were opened to get a clue about the relationship?"
301,How do I unghost a friend ?
302,"Men, what was the sexiest move a girl has done to makeout with you?"
303,What non-fiction book should everyone read?
304,How do I stop crying a lot/being a crybaby
305,"Guys, what are a few steps you take to get past the overwhelming feeling of loneliness after a break-up?"
306,"Men who have defeated self-hate, how have you overcome it?"
307,How serious is bro code?
308,Inner peace & fulfillment or financial security - which one is more important for you to achieve in life?
309,"I'm a female saving myself for marriage on personal reasons. But, I know how society and dating works now and wonder, is this a big deal? If so, why?"
310,What's something a woman could do that would melt your heart
311,What is the Appeal of Onlyfans?
312,What does your S/o do to make you feel loved/wanted ?
313,What motivates you to get out of bed every morning?
314,"Men who are 30+, what should one do in his 20s."
315,"Guys of reddit, do you perceive a girl as more attractive when she plays hard to get? If so, why?"
316,"To those of you who choose not to use online dating apps to find relationships and/or hookups, what is your reason?"
317,How to make 100 hours pass by quickly?
318,"Men of Reddit, do you find a woman more attractive if she wears a fragrance, or do you prefer her natural scent? Why?"
319,How are you guys dealing with your mental health in lockdown?
320,Men over 40ys old who have never married or had a serious relationship. What are the pros and cons of the life you've lived?
321,Ex-addicts of Reddit what was the moment you decided to stop your addiction
322,What was your favorite fairytale/folk tale/fable growing up?
323,"What are some rules to follow or things to keep in mind when dating or in a relationship, that aren't intuitive to you?"
324,Have you ever dated someone who you didn’t have a lot in common? What was it like? Are you still together?
325,What are your thoughts about astrology/zodiac? Do you care about it or is annoying when someone talks about it?
326,Which TV Series got you hooked right from the Beginning?
327,What's the state of sex robot technology today?
328,"How do I become tougher, or stand for myself in a confrontation?"
329,do you like tall or short girls and why ?
330,Has anyone used online training to get a job? What program did you do and how did you get hired?
331,What’s the most attractive thing about a girls body to you personally
332,What are some random quirks of being a guy?
333,What's the best advise you can give in a single sentence to guys who struggle with women?
334,What’s the worst dating advice you’ve ever heard?
335,How to I improve social life after university?
336,"Men who ended up in a long term relationship with an significant other that was the total opposite( personality and/or lifestyle wise) of themselves (ex: you’re introvert and they’re an extrovert or you’re a country boy and they’re in heavy metal), how did y’all meet?"
337,What is a job that more guys should be into?
338,"Men... Is there that ONE girl in your life that is so different from the rest? That is so unexplainable, you don't even understand why?"
339,"Men who live in the western world , how do you trust the girl you’re sleeping with completely safe ?"
340,"Men who witnessed a death of someone, how has it affected you and how did you manage to overcome the feelings of fear etc?"
341,What is so attractive about sleeping with older women?
342,Peoole who always say to invest your money. What do you invest in?
343,How do you get enjoyment out of working out?
344,"People who have actually paid for hookers, how are they?"
345,"Men of Reddit, how do you value such quality as honour and it's relevance to today's life?"
346,"Does anyone still listen to Linkin Park? If you are a fan, how has your perspective changed since Chester's death?"
347,What’s the male version of “I’m not like other girls” ?
348,What's the best action movie to watch with a glass of whiskey to make yourself feel like a man?
349,When did you realize you were just like your father?
350,"Guys who have simply found themselves at points in their lives where they didn't crave or desire sex, emotionally or physically, how did people react?"
351,"Guys who have stretch marks, how do you get used to them or start liking them?"
352,What's the best way to end a friendship with a female friend you have feelings for?
353,How do you mitigate the itchiness of a new beard?
354,What's the male sexy surprise equivalent to lingerie/wake-up BJs/etc?
355,What is the Airspeed Velocity of an Unladen Swallow?
356,What is something you can say to make a man’s day better?
357,"Men of Reddit, how do people typically judge you by their first impressions?"
358,"Have any of you tried Master Classes online? And if so, what was your experience with them?"
359,What was your “Never know what you have till its gone” moment?
360,"Men of reddit, how did you feel when you first left your parent's house?"
361,How do I help my boyfriend feel okay about crying or “being a bitch”
362,"I had one of the worst days of my life today, the outcomes of which will probably put me through depression. How can I make myself not sad?"
363,What's the reasoning behind going sober all your life?
364,How do men easily lift women?
365,What is the most hurtful thing someone has said to you?
366,How do you show your girl that you love her and that she’s important to you?
367,How do you guys respond to compliments?
368,What dumb quarantine argument have you had with your significant other today?
369,What’s something that happened in your childhood that you should be over by now but just aren’t?
370,How often do you think of your female friends in a sexual way
371,How would you feel if a new partner requested you both get tested before having sex?
372,What's your subtle way of showing love?
373,"Men, what scents or perfumes really grab your attention?"
374,"For the men who are married, what made you know that your SO was the one and you had to propose?"
375,"Guys that don't normally cry, what movie made you tear up?"
376,Why do many men hate setting up dates??
377,What is the best/most considerate way you have been rejected?
378,What are some beautiful / eerie / sad / melancholy songs you listen to?
379,How can I get over feeling behind in life?
380,"Men who can cook, how much crap do you get from jealous co workers?"
381,What do you think about girls who wear fancy underwear before you have sex?
382,"Men who have been in relationships with women where you want/need less sex than they do, how do you deal with it?"
383,What are some good ways to boost your confidence?
384,What has caused you to be emotionally invulnerable/not be willing to open up to someone who cares
385,What's your experience with growing apart from a friend group
386,How do you control your anger?
387,"How did you handle a failed career? What happened, what did you learn, and what was the outcome?"
388,What are the weirdest things you've seen in public? Why?
389,What's the biggest animal you could beat in a fight?
390,What is something you do now as an adult that you swore you wouldn’t do as a child ?
391,What things do you notice now that you didn't before due to a job you've had?
392,What are the best things to be complimented on?
393,How has the lockdown changed your relationship with your wife?
394,How should woman react when a guy tells that she’s definitely his type except of she’s blonde but he likes brunette?
395,"Dudes, how come you keep going back to the same porn videos over and over again?"
396,How to deal with being shy and outgoing?
397,"Dads of Reddit, have you given your kids silly nicknames? If so, what do you call them?"
398,What is the male equivalent of the feeling of gently getting a strand of hair tucked behind your ear by someone?
399,What is something professional that you can study online and appear in a test to be verified?
400,What is your comfort food?
401,What is it about a woman that makes her good friend material to you (with or without benefits) but not someone you’d want to be in a committed relationship with?
402,What's your favorite Gundam?
403,What do you find attractive aside from looks?
404,"Anyone found a viable solution as to what to do with clothes that are too clean to go to the laundry, but already worn, so you can't put them back into the wardrobe? (except having them on the bed at day and on a chair at night)?"
405,What is some advice you have when it comes to buying your first car?
406,"Men who are into motor-boating, what is the appeal?"
407,"Men of reddit, whats something toxic your parents instilled in you that you make sure not to bring out in your children?"
408,Who do you think of when you masturbate? Do you normally stick with the pornstar or imagine someone else?
409,How much intimacy is in your friendships? Or how much/what kind of intimacy would you ideally want in your friendships?
410,When was the last time you felt truly cared about?
411,"Hey guys, how do you start off every day just so your brain functions properly?"
412,What was the purchase you made that instantly made you feel happy?
413,"Those of you in a long term relationship, how would you rate your sex life?"
414,What's a habit a young guy can implement to benefit his future self?
415,"Those that play an instrument, what do you play, how long, and how often?"
416,Have you ever been in love with someone you couldn't be with? What happened?
417,How did you improve your relationship with your dad?
418,"Ask men, what’s yours screen background on your phone?"
419,What popular food do you hate?
420,"Men of Reddit, how’s your financial situation at the moment?"
421,Any other functional alcoholic men here? How do you deal with it?
422,"guys with SO’s who have breast implants, did you like your SO more as natural, or after with fake tits? why?"
423,What am I (21M) supposed to do with nudes (from girls)?
424,How to spoil my pregnant wife?
425,How difficult is it to throw out a key you’ve found?
426,What are the worst red flags you have ignored?
427,"Hey guys, how do I emotionally connect with my introverted and kind of stoic partner when things are tough"
428,What's your go to ice breaker when trying to pick up women?
429,"Men of AskMen, if you aren’t a “hoe” anymore, do you miss being one (if you ever were)? Why/why not?"
430,How many of your guys are actually passionate about your career?
431,How would you react to a new fling disclosing to you that they were recently a sexual assault victim?
432,What was it like to fall in love with someone you didn’t want to or expect to fall in love with?
433,What's it like dating as a man over 35?
434,"Men who clicked on the links that said ""hot girls are 2 miles away"", what happened?"
435,Is it ever okay to tell a girl that the reason why you wouldn't date her is because of how she looks?
436,What makes men assume a girl is easy?
437,"Do you have a ""strategy"" when talking to women that actually works?"
438,What are the little things you love about your SO?
439,"As a girl, how do I reassure my guy friends that they have good bodies?"
440,What are the reasons for regretting not working more in 20s?
441,What makes a good leader?
442,What would 13 year old you be most surprised to learn about current you?
443,"Men who have daddy issues, what does it look like?"
444,What’s a song that makes you emotional?
445,How do you help a man feel safer in a relationship?
446,"Men, what is one thing you wish you could tell women?"
447,Men who consider themselves emotionally unavailable....Why is it that way? What do you think would help you to feel more open?
448,What makes a woman beautiful?
449,When is the appropriate time in life to buy dad shoes to embarrass my children?
450,[NSFW] What do you really think about the smell and taste of vaginas?
451,What's the most nonsensical recurrent stereotype in fiction?
452,"Guys, what's the best deodorant that *actually* prevents sweat stains on shirts?"
453,What musical collaboration between artists did you find pretty strange?
454,What do you guys think about strip-tease and such?
455,What would be your first drink to order in the pub when lockdown ends ?
456,"older guys of reddit, how was it watching your wife age?"
457,How do you clean up after masterbating?
458,What's a psychological barrier you can't cross?
459,"What’s something you like doing, but have zero desire to share with/do with a significant other?"
460,How do you get internal motivation for long-term goals if short-term is more attractive?
461,How much does it bother you if she can’t climax ?
462,What's the scariest thing thats happened to you recently?
463,What unexpected side effect did you experience from your job?
464,"Where did you meet your girlfriend, wife, boyfriend etc"
465,"Men who have fallen in love with their best/ good friends, how long were you able to hide it from them?"
466,How can I explain sexual harassment to a man in a relatable way?
467,What is your biggest texting pet peeve?
468,How would you feel if you found out your crush started dating someone who looked almost exactly like you?
469,"What bands have you discovered throught their songs being used in movies, tv shows, or trailers?"
470,Have you ever dated someone in the autism spectrum? How was that experience?
471,What are your reasons for contacting an ex years later?
472,How would you hide a giraffe?
473,What is a traditionally women's accessory that you'd love to use?
474,"Men of reddit, have you ever dated/married a woman that was older than you? How did it turn out?"
475,What is one opportunity you should never refuse?
476,How do you keep yourself normal and balanced and motivated around toxic people?
477,"If your daughter were a young/healthy doctor or nurse and was offered double-pay to work in a coved ward, what advice would you give them?"
478,What do you prefer to do right after sex? What awkward things has a partner done post-sex?
479,What's one thing your SO does that absolutely drives you nuts but you can't help thinking it's a small price to pay for having them in your life?
480,"Men of reddit, what is the single most cowardly thing you’ve ever done? Why did you do it? Did you ever regret it?"
481,How can I stop being bitter? I feel I grow colder and colder as time goes on.
482,What are some tips for men that are starting to grow out their hair?
483,"Men currently without a significant other, how is your mental health?"
484,"Unattractive guys who became attractive, when you did you realise that you're no longer ""ugly""?"
485,What are some reasons that discourage you from pursuing a serious relationship with a woman?
486,What are your worst dating app stories?
487,"Guys, what is the biggest turn on and turn off during foreplay/sex that girls don’t know about?"
488,How do you come to terms with not being man enough?
489,"You've been given enough financial backing to start your own business, what do you do?"
490,"Who is the worst couple you know, and why are they so terrible?"
491,What are your signs of a healthy relationship?
492,How likely are you to call a woman pretty or beautiful in the initial stages of dating before any intimacy happens?
493,How long has it been since someone last touched you in a meaningful way?
494,What can you do on a virtual date?
495,"What was the last (romantic) love story that really moved you emotionally, or what's one you keep coming back to?"
496,How do you know what job you want to do?
497,"Those who have a long list of traits that you want from a partner, what do you bring to the table?"
498,how does a girl initiate hanging out with a guy that has a girlfriend without being disrespectful to his girlfriend?
499,"If and when one is available, would you take male birth control? If not, why?"
