,Text
286,What is your relationship with body hair?
287,What is the saddest thing you’ve seen in person?
288,How do you remember your worth?
289,What’s something you WOULDN’T change about yourself?
290,"What's the best ""slapstick"" moment you've seen in person?"
291,Women with long hair - how do you get it out of your clothes?
292,How have you learnt to stop kicking yourself when you make mistakes in relationships/general life?
293,"If you were in a successful long distance relationship, how did you over come the usual obstacles?"
294,"Women who used to have a lot of trouble getting out of bed in the morning, how did you overcome it?"
295,What are your must-have hygiene/cosmetic products?
296,What made you decide to cut a depressed/suicidal friend/partner out of your life?
297,"Has anyone ordered off of Shein before, how is the sizing?"
298,Have you ever done psychedelics? What is your opinion on them?
299,"Ladies who dropped out of uni, why did you do it and was it worth it?"
300,What do you recommend everyone try at least once?
301,How do you learn to be comfortable enough to dance when you have body image issues?
302,"What is your favorite brand of black liquid/pen eyeliner? Like, your holy grail, “I would die for this eyeliner”? My fav got discontinued and I need a new one ASAP"
303,"What's a place you could easily spend 24 hours alone in, besides your house?"
304,What's your favourite kind of doughnut?
305,"Women who can run on high heels , how?"
306,What are some romantic things you can do for yourself? 💕
307,What’s something people don’t talk much about that improves your life?
308,MARRIED WOMEN OF REDDIT: What was the feeling reaction while you were walking down the aisle?
309,"Women who don't enjoy being hugged or touched, how do you keep the intimacy going strong with your partner?"
310,What is your most helpful tip that helped you lose weight and kept it down?
311,"Women who've had an SO go to prison, did you continue or end the relationship? What led you to your decision?"
312,How often have strangers come up to you to ask you out in a non-social setting? How have you responded?
313,"Those with SO, how did you meet them?"
314,"What is a song from an era or genre that you are really unfamiliar with, that you recently fell in love with?"
315,"Older women who have had depression for a long time, how do you cope?"
316,How do you feel about your ex(es)? Are you happy for them?
317,What was an effort you made for your SO that didn't get as appreciated as you thought it would and now you feel silly about?
318,What do you think of the death of Irfan Khan?
319,"For women who are overwhelmed at work, what do you do to say calm?"
320,What is something that happened years ago which changed your life forever?
321,"Those of you who don't have great relationships with your moms, how did it become that way and how do you deal with it?"
322,What city is underrated and why?
323,What are your best qualities?
324,Those of you who have reinvented yourselves-- how did you do it and what has your life been like since?
325,"Women,who have moved countries for love/marriage, what did you do,how did you do it and do you regret it?"
326,"Women who don't shave, do you have any tips for maintenance/dealing with judgment?"
327,What do you think is an underrated skill?
328,How do you stay safe online dating? Any successful online dating stories?
329,"Have you ever been kissed by another woman? If so, how did you feel after that?"
330,What's the fastest you've known you wanted to marry someone?
331,What's one thing that happened to you that actually turned out to be a blessing in disguise?
332,What is your favorite pair of jeans that were 100% worth the money?
333,What music are you listening to lately to feel happy/positive?
334,"You are one of the last two people on earth. The other person is a known celebrity or living famous person that you'll spend your life with, and they will magically like you and find you attractive (if you wish them to). Who would you pick and why?"
335,"To those who wear lockets, what do you keep in them?"
336,When/How did you finally find a group of friends that stuck around?
337,What game show would you kick ass on?
338,Who is your favorite male fictional character?
339,What have you learned from your failed friendships and relationships over the years? What has it taught you about yourself?
340,What is something you're glad you did?
341,What’s a sign that someone is interested in you?
342,What is some common or popular marriage advice that you don’t agree with?
343,"Women who have their life together, how?"
344,What are the things that your SO casually do that makes you cringe?
345,Have you ever rejected another woman’s friendship? Why?
346,What's your favorite Bob Ross episode?
347,How much does your partner inspire you?
348,What's that unique thing you do that makes that recipe taste so damn good?
349,"If you were to be with a partner you deeply care for and love but doesn’t quite satisfy you emotionally, how would you move forward? (Stay,leave etc.)"
350,What’s your favorite poem?
351,Did you ever find an ex of yours on a dating app after you thought you had moved on? How did you feel?
352,What are some tips for during the talking stage ?
353,[Dating] How do you know you’re settling?
354,"Women who have been gaslighted in previous relationships, how did you overcome the fear of communicating with your new partner?"
355,"Women who live alone, what measures have you taken to protect yourself?"
356,"Women who are their Significant other's first relationship, what are some problems you guys faced because of the lack of experience?"
357,What is the top most important unwritten rule of being a girl?
358,What opportunities did you miss because you were too sad and unmotivated? How did you cope later on?
359,What are your most illogical fears?
360,Women of Reddit / How have your wedding plans changed if you were planning for this summer / fall?
361,"Ladies, how old were you when the worst period cramp happened and how were you reacting?"
362,What was the most difficult situation you've been in at work and how did you deal with it?
363,"Women with/had alopecia, have you been able to find a solution to re-grow your hair? If not, how did you come to terms with eventually being bald?"
364,"wlws, have you ever noticed a woman act weird/uncomfortable around you after you came out to them? how did you deal with that?"
365,"If you came with a warning label, what would it say?"
366,"If money were no object, what five places would you like to visit?"
367,"If you like to read, what makes you enjoy it?"
368,Whatre the first few things you do directly after waking up?
369,How do you feel about everyone around you having or wanting kids if you don't want children yourself?
370,How important is it to you to find your career fulfilling?
371,What are you a sucker for?
372,How did you recognise your SO was not that into you?
373,What opinion are you scared to share with your friends?
374,What's been you experience with being starstruck by someone's attractiveness?
375,how many house plants do you have? do you have a favorite?
376,How do you know someone is genuinely interested in you and not playing games?
377,What is the stupidest thing your significant other has been stubborn about?
378,"Ladies who have given up social media, how has your life been since deleting your accounts?"
379,"Women who've had partners that told their parents about problems in their relationship with you, what became the greatest issue that resulted from this?"
380,"Which person from your past are you grateful is no longer in your life, and why?"
381,What is something that has completely changed about you over the years?
382,"Women of Reddit who’ve been laid off/ furloughed, what are the feels?"
383,"What are some assumptions that people make about marriage/committed relationships, that simply aren’t true?"
384,If you had a spare room in your house what would you do with it?
385,How do you feel less lonely when it feels like everyone else around you is getting into relationships?
386,Which goddess would you like to be your mother?
387,What do you feel deprived of?
388,"What is a movie/TV show adaptation that you think is different from the book, but not necessarily bad?"
389,"Women of Reddit, what is your biggest concern at the moment?"
390,what beauty product changed your life?
391,How do you make the best impression when you’re starting off in a new job?
392,What are some 'childish' things you still do as an adult?
393,How do you deal with acne and skin problems?
394,Have you ever dated someone when you had a crush on someone else? What happened?
395,"Do you dream often when you sleep at night? If so, what dreams/nightmares have you had recently?"
396,What's something that you notice about others that you feel like most people don't notice or never think about?
397,When should you NOT enter a romantic relationship?
398,Women of reddit what was it like meeting your soulmate? What kind of emotions were you feeling?
399,What's your aesthetic?
400,How would you describe your life in 6 words?
401,What's something you've done that people around you didn't understand but you were sure was right for you?
402,Ladies! What are some drugstore makeup products that you would really recommend? What do you like about them?
403,Do you have any estranged relatives? What happened?
404,"The supplemental rules for ""Mate-Free Monday"" are now in effect."
405,Your salary is now 1 million dollars a year and you can do anything as a field of work as long as you are working and contributing something positive to the world. What is your new job?
406,How important are apologies to you?
407,"Hey ladies, random question - whats your wallpaper on your phone?"
408,At which age(s) did you get your ears pierced?
409,"Women who play guitar, what is your favorite brand/model?"
410,"Ladies of Reddit, how to be more thick-skinned?"
411,How has parental favouritism affected your relationships with siblings?
412,"Ladies, what are the goofiest or weirdest things you and your s/o do to each other?"
413,"Women who have stopped their periods with BC, which ones have you used? What are their side effects?"
414,Women who have struggled with low self esteem: how did you learn to love yourself?
415,What is your opinion on Animal Crossing: New Horizons?
416,Have you had a bad feeling about someone for no apparent reason? What happened?
417,What are your favorite food shows and why?
418,If you had $300 what would you spend it on?
419,"Women who overcame major insecurities, how has your daily life changed?"
420,What was your healing process like after leaving an abusive relationship?
421,What made you realize that something you thought you knew about a person in your life was a lie?
422,How to deal with being the one that breaks up?
423,"What in your life needs to be said, that you're too ashamed for those closest to you to hear?"
424,What is the coolest thing you have done that no one witnessed?
425,What is the most impactful thing you learned in your twenties?
426,"What is a book you wish all men would read, and why?"
427,Ladies what was your intuition right about that changed a major part of your life?
428,"Women who’ve had children in a non-traditional way i.e. surrogacy, IVF, adoption, some other way I might be missing; what’s your story?"
429,What Social Customs Do You Wish Would Just Disappear?
430,What was The Moment when you realized what you wanted to do with your life?
431,What was your best purchase of 2019?
432,What's a comment someone made offhand that you still think about to this day?
433,"Women of color, what has been your experience with the healthcare system?"
434,"You're talking to someone and realize you're not over your ex, how do you handle the situation?"
435,What is something you miss right now?
436,"Women who only wash their hair once or twice a week, do you work out most days? How do deal with sweaty hair?"
437,What are you interested in that most people aren’t?
438,"Women on Reddit, what are your stance on poligamy ?"
439,What do you think you spend most money on per year?
440,"If you were any breed of dog, which do you think you would be, and why?"
441,Have you ever been emotionally manipulated into getting into a relationship (that you knew you didn't want from the beginning)? How did you realise/deal with it?
442,"Ladies, were your parent(s) strict, relaxed or just right? What were they like?"
443,"Women that don't like writing, how do you let your feelings out?"
444,What are good binge-worthy shows to watch?
445,have you ever cried during/after sex? why?
446,"Women who grew up in dysfunctional homes: how has it impacted your relationships, both romantic and otherwise, and how did you deal with it?"
447,"Ladies who have randomly felt like they aren’t pretty anymore or look now look “frumpy”, how did you overcome that feeling?"
448,How do you deal with discharge?
449,What emoji do you hate the most?
450,Do you know anyone with notification anxiety? How do they deal with it?
451,"To all the women FilmMakers, what story do you think needs to be portrayed more?"
452,What is your favorite song right now?
453,"Women with commitment issues, how did you overcome them?"
454,Would you start a romantic relationship knowing it has an expiry date? Why?
455,What has helped you heal from perfectionism?
456,What is your personal ghost story?
457,"Women Who Have Considered Motorcycling, but Haven't Pulled the Trigger: Why not?"
458,What is the person that you become when you think no one's watching like?
459,What are you missing shopping for?
460,What age did you become cautious of your body?
461,"How are you playful in your life as an adult, either solo or with others?"
462,What are three words that describe your texting style?
463,What jobs would you like to try out for a day?
464,What’s The Best Comeback You Can Think Of When a You Encounter Sexism Of Any Kind?
465,How do you let go of an obsessive thought that keeps popping up in your head multiple times a day?
466,What are some things that make you really *feel* sexy besides sex itself?
467,"What are the mysteries, serious or silly, that keep you awake at night?"
468,How did you learn to forgive your significant other?
469,"What are some rules to follow or things to keep in mind when dating or in a relationship, that aren't intuitive to you?"
470,"Ladies who have had a wedding: what song did you walk down the aisle, and what song was your first dance to?"
471,How do you work up the courage to go on online dates?
472,How would you feel if your SO loved you but wasn't very expressive of it?
473,How did you learn to embrace the natural features about yourself rather than alter the?
474,"Among the things you own, which are you the most fond of?"
475,How would you want someone to start talking to you if you didn't really know them?
476,When did you find out you had horrible friends?
477,"What's your ""colleague from hell"" story?"
478,"Parents, children, and whoever else is in the world: did your parents have a big problem with you locking your bedroom door growing up? If you’re a parent who doesn’t like locked child-bedroom doors, why?"
479,"Women with no immediate plans to get married or have a baby, how are your friends and family responding to this?"
480,"The supplemental rules for ""Mate-Free Monday"" are now in effect."
481,What's the difference between love and infatuation?
482,"Women who've had to get stitches/sutures in your face, how well did it ultimately heal?"
483,What would you tell your daughter before she moved in with a partner/SO?
484,How can you tell that the relationship is going nowhere?
485,What is something you enjoy doing despite not being good at it?
486,Women who did HRT during perimenopause what was your experience like?
487,What is currently your favorite piece of music?
488,"Have you ever had a ""friendship"" that was only a one-way street? Why was it like that?"
489,"What aspects of your life do you not share with friends? If any, of course."
490,"(Spoiler) Redditors who have watched 'You', if you were Joe and had found your soulmate revealed to you as Love (S02E10), what would you have done?"
491,What is a dumb thing you use to believe for a very long time ?
492,"How long before the actual break-up, did you know, that you wanted to break-up?"
493,What behavior changes have you made so that men stops mistaking your friendliness as flirting or a sign that you are interested?
494,How do you talk about your accomplishments without coming off as braggy?
495,What is your favorite song or playlist you listen to when you want to feel empowered?
496,"What's something that your SO does that they think is sexy, but is actually a huge turn off?"
497,How many pyjamas do you own?
498,What is something that was said or done during labour that you’ll never forget?
499,"Have any women here overcome vaginismus? If so, how?"
